search_id,repository,object_or_commit,path,relevance,recovery_status,search_method,result
SEARCH-001,CliniCause,f71c9bab70c8fb6347c7692236cd2cfd03e84fa1,all reachable history,Stage 5.2 baseline and provenance records,EXACT_GIT_HISTORY_RECOVERY,git log --all; git show; git diff; git ls-tree,f71c9ba verified with parent 11a2cb4; Stage 5.2 audit records located.
SEARCH-002,CliniCause,unreachable objects,N/A,Potential lost provenance artifacts,NOT_FOUND_AFTER_EXHAUSTIVE_LOCAL_SEARCH,git fsck --full --no-reflogs --unreachable --no-progress,No dangling objects reported.
SEARCH-003,causal-irregular-time-series,6880c6e;4880a91;417bb32;1977bc2,configs/global-variables.csv,Recover numbered producing config files,EXACT_GIT_HISTORY_RECOVERY,git log --all; git ls-tree; git cat-file; content SHA-256,Reachable history has only unnumbered config basenames; numbered final paths were not recovered.
SEARCH-004,causal-irregular-time-series,unreachable objects,N/A,Potential lost configs/source manifests,NOT_FOUND_AFTER_EXHAUSTIVE_LOCAL_SEARCH,git fsck --full --no-reflogs --unreachable --no-progress,No dangling objects reported.
SEARCH-005,STraTS,all reachable history,training/export/config candidates,Predictive command/split/checkpoint/source lineage,NOT_FOUND_AFTER_EXHAUSTIVE_LOCAL_SEARCH,git log --all; git ls-tree; git fsck,"No archived producing split manifest, source version, or checkpoint-export manifest recovered."
SEARCH-006,final-results archive,12 run_summary.json,causal output families,Recover historical causal command/stage evidence,RUN_SUMMARY_RECORDED,JSON parse and SHA-256 verification,"Exact argv arrays, CWDs, stage statuses, return codes, timestamps, and absolute paths recovered."
SEARCH-007,final-results archive,10 predictive log.txt records,STraTS output families,Recover prediction export args/seed/split argument,LOG_RECORDED,Log parse and SHA-256 verification,Each log records Namespace arguments including seed=2023 and predict_split=all; no split IDs or full shell command.
SEARCH-008,working tree,non-sensitive project files only,manifests/configs/commands/environments,Locate untracked provenance records,NOT_FOUND_AFTER_EXHAUSTIVE_LOCAL_SEARCH,"find and rg excluding .env, credentials, shell history, SSH, and raw data",No additional non-sensitive producing manifest recovered.
