claim_id,file,chapter_or_section,line_or_excerpt,claim_type,claim_summary,numeric_expression,citation_keys,authoritative_source,exact_source_location,support_status,qualification_status,terminology_status,hierarchy_status,cross_language_status,required_action,notes
C0292,thesis-writing/thesis/chapters/07_causal_methodology.tex,Thesis,"line 37: Observed measurements | Measurement aggregates and manifestations. These document how clinical constructs relate to observed data but are excluded from adjustment-set candidates. | Ten observed aggregate nodes, including inflammatory, cardiac, respiratory, hemodynamic, renal, liver, hematologic, neurologic, metabolic, and availability-count measurements. | Fifteen observed aggregate nodes, including vital, laboratory, medication, procedure, ventilator, culture, and availabili",WORKFLOW,"Observed measurements | Measurement aggregates and manifestations. These document how clinical constructs relate to observed data but are excluded from adjustment-set candidates. | Ten observed aggregate nodes, including inflammatory, cardiac, respiratory, hemodynamic, renal, liver, hematologic, neurologic, metabolic, and availability-count measurements. | Fifteen observed aggregate nodes, including vital, laboratory, medication, procedure, ventilator, culture, and availability/count nodes.",,,cross-thesis evidence audit,thesis; checked source/tables,SUPPORTED_WITH_QUALIFICATION,EXPLICITLY_BOUNDED,CONSISTENT,ALIGNED,NOT_APPLICABLE,RETAIN,Scope and terminology bounded.
C0293,thesis-writing/thesis/chapters/07_causal_methodology.tex,Thesis,"line 38: Treatment or care process | Care-process nodes retained in the graph to represent downstream clinical response or measurement context. These are not treated as adjustment candidates. | Mechanical ventilation node. | Antibiotics, vasopressors, mechanical ventilation, and dialysis nodes.",WORKFLOW,"Treatment or care process | Care-process nodes retained in the graph to represent downstream clinical response or measurement context. These are not treated as adjustment candidates. | Mechanical ventilation node. | Antibiotics, vasopressors, mechanical ventilation, and dialysis nodes.",,,cross-thesis evidence audit,thesis; checked source/tables,SUPPORTED_WITH_QUALIFICATION,EXPLICITLY_BOUNDED,CONSISTENT,ALIGNED,NOT_APPLICABLE,RETAIN,Scope and terminology bounded.
C0294,thesis-writing/thesis/chapters/07_causal_methodology.tex,Thesis,"line 39: Missingness or measurement intensity | Process nodes for ordering and measurement availability. These are graph variables but not adjustment candidates. | Lactate/ABG ordering, troponin ordering, and measurement intensity. | Measurement intensity, with outgoing links to availability, laboratory-count, and vital-count nodes.",WORKFLOW,"Missingness or measurement intensity | Process nodes for ordering and measurement availability. These are graph variables but not adjustment candidates. | Lactate/ABG ordering, troponin ordering, and measurement intensity. | Measurement intensity, with outgoing links to availability, laboratory-count, and vital-count nodes.",,,cross-thesis evidence audit,thesis; checked source/tables,SUPPORTED_WITH_QUALIFICATION,EXPLICITLY_BOUNDED,CONSISTENT,ALIGNED,NOT_APPLICABLE,RETAIN,Scope and terminology bounded.
C0295,thesis-writing/thesis/chapters/07_causal_methodology.tex,Thesis,line 40: Outcome | Mortality endpoint. | . | .,WORKFLOW,Outcome | Mortality endpoint. | . | .,,,cross-thesis evidence audit,thesis; checked source/tables,SUPPORTED_WITH_QUALIFICATION,EXPLICITLY_BOUNDED,CONSISTENT,ALIGNED,NOT_APPLICABLE,RETAIN,Scope and terminology bounded.
C0296,thesis-writing/thesis/chapters/07_causal_methodology.tex,Thesis,"line 44: The PhysioNet graph contains 30 nodes and 45 directed edges. The implemented exposure list contains the ten non-chronic latent proxy states in the PhysioNet configuration: global severity, shock, respiratory failure, renal dysfunction, hepatic dysfunction, coagulation/hematologic dysfunction, inflammation/sepsis burden, neurologic dysfunction, cardiac injury/strain, and metabolic derangement. Chronic baseline risk is retained as an upstream baseline proxy and effect-modifier ",IMPLEMENTATION,"The PhysioNet graph contains 30 nodes and 45 directed edges. The implemented exposure list contains the ten non-chronic latent proxy states in the PhysioNet configuration: global severity, shock, respiratory failure, renal dysfunction, hepatic dysfunction, coagulation/hematologic dysfunction, inflammation/sepsis burden, neurologic dysfunction, cardiac injury/strain, and metabolic derangement. Chronic baseline risk is retained as an upstream baseline proxy and effect-modifier candidate rather than as an analyzed exposure.",30;45,,cross-thesis evidence audit,thesis; checked source/tables,SUPPORTED_WITH_QUALIFICATION,EXPLICITLY_BOUNDED,CONSISTENT,ALIGNED,NOT_APPLICABLE,RETAIN,Scope and terminology bounded.
C0297,thesis-writing/thesis/chapters/07_causal_methodology.tex,Thesis,"line 46: The MIMIC graph contains 36 nodes and 57 directed edges. The implemented exposure list contains nine non-chronic latent proxy states: global severity, inflammation/sepsis, shock, respiratory failure, renal dysfunction, hepatic/coagulation dysfunction, neurologic dysfunction, cardiac strain, and metabolic derangement. Chronic burden is retained as an upstream baseline proxy and effect-modifier candidate. The MIMIC graph contains richer administrative and care-process structure",IMPLEMENTATION,"The MIMIC graph contains 36 nodes and 57 directed edges. The implemented exposure list contains nine non-chronic latent proxy states: global severity, inflammation/sepsis, shock, respiratory failure, renal dysfunction, hepatic/coagulation dysfunction, neurologic dysfunction, cardiac strain, and metabolic derangement. Chronic burden is retained as an upstream baseline proxy and effect-modifier candidate. The MIMIC graph contains richer administrative and care-process structure than the PhysioNet graph, but the downstream adjustment implementation only uses graph nodes that can be mapped into the analysis dataframe.",36;57,,cross-thesis evidence audit,thesis; checked source/tables,SUPPORTED_WITH_QUALIFICATION,EXPLICITLY_BOUNDED,CONSISTENT,ALIGNED,NOT_APPLICABLE,RETAIN,Scope and terminology bounded.
C0298,thesis-writing/thesis/chapters/07_causal_methodology.tex,Thesis,"line 48: Qualified clinical review of the graph arrows and a complete record of the human decisions applied to the LLM-assisted proposals remain unavailable. The graph artifacts and active source structure are recorded, but the exact producing source version, configuration, and command are not fully recovered.",IMPLEMENTATION,"Qualified clinical review of the graph arrows and a complete record of the human decisions applied to the LLM-assisted proposals remain unavailable. The graph artifacts and active source structure are recorded, but the exact producing source version, configuration, and command are not fully recovered.",,,cross-thesis evidence audit,thesis; checked source/tables,SUPPORTED_WITH_QUALIFICATION,EXPLICITLY_BOUNDED,CONSISTENT,ALIGNED,NOT_APPLICABLE,RETAIN,Scope and terminology bounded.
C0299,thesis-writing/thesis/chapters/07_causal_methodology.tex,Thesis,"line 52: For each dataset, treatment-like proxy state, and outcome pair, the causal pipeline derives an adjustment set from the project DAG and the columns available in the analysis dataframe. The implementation first maps dataframe variables to graph nodes and graph nodes back to dataframe columns. Background and latent graph nodes are eligible only if they can be represented by available columns. Observed measurement nodes, care-process nodes, missingness nodes, and the outcome node",IMPLEMENTATION,"For each dataset, treatment-like proxy state, and outcome pair, the causal pipeline derives an adjustment set from the project DAG and the columns available in the analysis dataframe. The implementation first maps dataframe variables to graph nodes and graph nodes back to dataframe columns. Background and latent graph nodes are eligible only if they can be represented by available columns. Observed measurement nodes, care-process nodes, missingness nodes, and the outcome node are excluded from candidate adjustment sets.",,,cross-thesis evidence audit,thesis; checked source/tables,SUPPORTED_WITH_QUALIFICATION,EXPLICITLY_BOUNDED,CONSISTENT,ALIGNED,NOT_APPLICABLE,RETAIN,Scope and terminology bounded.
C0300,thesis-writing/thesis/chapters/07_causal_methodology.tex,Thesis,"line 54: Let \(G\) denote the implemented project DAG, \(A\) the binary proxy-state exposure, and \(Y\) the in-hospital mortality outcome. The code constructs a graph \(G_\) by removing outgoing edges from \(A\). This is a project helper for finding adjustment candidates; it should not be confused with the usual intervention graph notation that removes incoming edges into \(A\). The initial candidate pool is:",IMPLEMENTATION,"Let \(G\) denote the implemented project DAG, \(A\) the binary proxy-state exposure, and \(Y\) the in-hospital mortality outcome. The code constructs a graph \(G_\) by removing outgoing edges from \(A\). This is a project helper for finding adjustment candidates; it should not be confused with the usual intervention graph notation that removes incoming edges into \(A\). The initial candidate pool is:",,,cross-thesis evidence audit,thesis; checked source/tables,SUPPORTED_WITH_QUALIFICATION,EXPLICITLY_BOUNDED,CONSISTENT,ALIGNED,NOT_APPLICABLE,RETAIN,Scope and terminology bounded.
C0301,thesis-writing/thesis/chapters/07_causal_methodology.tex,Thesis,"line 56: \[ (A,Y)= _ _G(A) _G_(Y) _G(A) \A,Y\, \]",WORKFLOW,"\[ (A,Y)= _ _G(A) _G_(Y) _G(A) \A,Y\, \]",,,cross-thesis evidence audit,thesis; checked source/tables,SUPPORTED_WITH_QUALIFICATION,EXPLICITLY_BOUNDED,CONSISTENT,ALIGNED,NOT_APPLICABLE,RETAIN,Scope and terminology bounded.
C0302,thesis-writing/thesis/chapters/07_causal_methodology.tex,Thesis,"line 65: where \(_\) is the set of available graph nodes whose node type is background or latent. The implementation then enumerates backdoor paths between \(A\) and \(Y\) in the undirected skeleton whose first directed edge points into \(A\). A path is treated as blocked if an adjusted non-collider is present or if an unadjusted collider has no adjusted descendant. This is an encoded graphical test over the project DAG, not proof that all real-world confounding has been controlled.",IMPLEMENTATION,"where \(_\) is the set of available graph nodes whose node type is background or latent. The implementation then enumerates backdoor paths between \(A\) and \(Y\) in the undirected skeleton whose first directed edge points into \(A\). A path is treated as blocked if an adjusted non-collider is present or if an unadjusted collider has no adjusted descendant. This is an encoded graphical test over the project DAG, not proof that all real-world confounding has been controlled.",,,cross-thesis evidence audit,thesis; checked source/tables,SUPPORTED_WITH_QUALIFICATION,EXPLICITLY_BOUNDED,CONSISTENT,ALIGNED,NOT_APPLICABLE,RETAIN,Scope and terminology bounded.
C0303,thesis-writing/thesis/chapters/07_causal_methodology.tex,Thesis,"line 67: The preferred helper is the safe expanded adjustment mode. It begins with the full candidate pool, removes colliders on the encoded backdoor paths and removes their descendants, then checks whether the remaining pool blocks all encoded backdoor paths. If it succeeds, this expanded pool is returned. If it does not block all paths, the pipeline falls back to a greedy minimal helper that starts from the candidate pool and removes variables in sorted order only while all encoded ",IMPLEMENTATION,"The preferred helper is the safe expanded adjustment mode. It begins with the full candidate pool, removes colliders on the encoded backdoor paths and removes their descendants, then checks whether the remaining pool blocks all encoded backdoor paths. If it succeeds, this expanded pool is returned. If it does not block all paths, the pipeline falls back to a greedy minimal helper that starts from the candidate pool and removes variables in sorted order only while all encoded backdoor paths remain blocked. The resulting set is inclusion-minimal under the implementation order; it is not guaranteed to be the unique minimal adjustment set.",,,cross-thesis evidence audit,thesis; checked source/tables,SUPPORTED_WITH_QUALIFICATION,EXPLICITLY_BOUNDED,CONSISTENT,ALIGNED,NOT_APPLICABLE,RETAIN,Scope and terminology bounded.
C0304,thesis-writing/thesis/chapters/07_causal_methodology.tex,Thesis,line 73: implementation step | source behavior | thesis interpretation,IMPLEMENTATION,implementation step | source behavior | thesis interpretation,,,cross-thesis evidence audit,thesis; checked source/tables,SUPPORTED_WITH_QUALIFICATION,EXPLICITLY_BOUNDED,CONSISTENT,ALIGNED,NOT_APPLICABLE,RETAIN,Scope and terminology bounded.
C0305,thesis-writing/thesis/chapters/07_causal_methodology.tex,Thesis,line 77: implementation step | source behavior | thesis interpretation,IMPLEMENTATION,implementation step | source behavior | thesis interpretation,,,cross-thesis evidence audit,thesis; checked source/tables,SUPPORTED_WITH_QUALIFICATION,EXPLICITLY_BOUNDED,CONSISTENT,ALIGNED,NOT_APPLICABLE,RETAIN,Scope and terminology bounded.
C0306,thesis-writing/thesis/chapters/07_causal_methodology.tex,Thesis,"line 80: Graph and column aliasing | Maps selected dataframe columns such as age, sex/gender, ICU type, admission context, and chronic proxy states to project graph nodes. | Adjustment is limited by what the analysis dataframe actually contains; graph nodes without available mapped columns cannot be adjusted for.",WORKFLOW,"Graph and column aliasing | Maps selected dataframe columns such as age, sex/gender, ICU type, admission context, and chronic proxy states to project graph nodes. | Adjustment is limited by what the analysis dataframe actually contains; graph nodes without available mapped columns cannot be adjusted for.",,,cross-thesis evidence audit,thesis; checked source/tables,SUPPORTED_WITH_QUALIFICATION,EXPLICITLY_BOUNDED,CONSISTENT,ALIGNED,NOT_APPLICABLE,RETAIN,Scope and terminology bounded.
C0307,thesis-writing/thesis/chapters/07_causal_methodology.tex,Thesis,"line 81: Allowed nodes | Keeps only graph nodes typed as background or latent and available in the dataframe. | Measurement, care-process, missingness, and outcome variables are deliberately excluded from candidate adjustment sets.",WORKFLOW,"Allowed nodes | Keeps only graph nodes typed as background or latent and available in the dataframe. | Measurement, care-process, missingness, and outcome variables are deliberately excluded from candidate adjustment sets.",,,cross-thesis evidence audit,thesis; checked source/tables,SUPPORTED_WITH_QUALIFICATION,EXPLICITLY_BOUNDED,CONSISTENT,ALIGNED,NOT_APPLICABLE,RETAIN,Scope and terminology bounded.
C0308,thesis-writing/thesis/chapters/07_causal_methodology.tex,Thesis,"line 82: Candidate pool | Intersects allowed nodes with ancestors of exposure and ancestors of outcome in the outgoing-edge-removed graph, then removes exposure descendants and the exposure/outcome nodes. | Candidate variables are source-defined pre-exposure or upstream variables under the project DAG.",WORKFLOW,"Candidate pool | Intersects allowed nodes with ancestors of exposure and ancestors of outcome in the outgoing-edge-removed graph, then removes exposure descendants and the exposure/outcome nodes. | Candidate variables are source-defined pre-exposure or upstream variables under the project DAG.",,,cross-thesis evidence audit,thesis; checked source/tables,SUPPORTED_WITH_QUALIFICATION,EXPLICITLY_BOUNDED,CONSISTENT,ALIGNED,NOT_APPLICABLE,RETAIN,Scope and terminology bounded.
C0309,thesis-writing/thesis/chapters/07_causal_methodology.tex,Thesis,"line 83: Backdoor-path check | Enumerates encoded backdoor paths and applies collider/non-collider blocking rules. | The check assesses the implemented graph, not unmeasured real-world mechanisms outside the DAG.",IMPLEMENTATION,"Backdoor-path check | Enumerates encoded backdoor paths and applies collider/non-collider blocking rules. | The check assesses the implemented graph, not unmeasured real-world mechanisms outside the DAG.",,,cross-thesis evidence audit,thesis; checked source/tables,SUPPORTED_WITH_QUALIFICATION,EXPLICITLY_BOUNDED,CONSISTENT,ALIGNED,NOT_APPLICABLE,RETAIN,Scope and terminology bounded.
C0310,thesis-writing/thesis/chapters/07_causal_methodology.tex,Thesis,"line 84: Safe expanded set | Removes colliders and descendants of colliders before testing whether the remaining pool blocks paths. | Main adjustment mode, intended to reduce collider-conditioning risk.",WORKFLOW,"Safe expanded set | Removes colliders and descendants of colliders before testing whether the remaining pool blocks paths. | Main adjustment mode, intended to reduce collider-conditioning risk.",,,cross-thesis evidence audit,thesis; checked source/tables,SUPPORTED_WITH_QUALIFICATION,EXPLICITLY_BOUNDED,CONSISTENT,ALIGNED,NOT_APPLICABLE,RETAIN,Scope and terminology bounded.
C0311,thesis-writing/thesis/chapters/07_causal_methodology.tex,Thesis,"line 85: Minimal fallback | Greedily removes sorted candidate variables while preserving path blocking. | A deterministic implementation fallback, not a claim that no alternative sufficient set exists.",IMPLEMENTATION,"Minimal fallback | Greedily removes sorted candidate variables while preserving path blocking. | A deterministic implementation fallback, not a claim that no alternative sufficient set exists.",,,cross-thesis evidence audit,thesis; checked source/tables,SUPPORTED_WITH_QUALIFICATION,EXPLICITLY_BOUNDED,CONSISTENT,ALIGNED,NOT_APPLICABLE,RETAIN,Scope and terminology bounded.
C0312,thesis-writing/thesis/chapters/07_causal_methodology.tex,Thesis,line 86: Identifiability flag | Records whether available mapped variables block all encoded backdoor paths in the project DAG. | A project-DAG availability diagnostic; it should not be described as definitive causal identification in the clinical population.,IMPLEMENTATION,Identifiability flag | Records whether available mapped variables block all encoded backdoor paths in the project DAG. | A project-DAG availability diagnostic; it should not be described as definitive causal identification in the clinical population.,,,cross-thesis evidence audit,thesis; checked source/tables,SUPPORTED_WITH_QUALIFICATION,EXPLICITLY_BOUNDED,CONSISTENT,ALIGNED,NOT_APPLICABLE,RETAIN,Scope and terminology bounded.
C0313,thesis-writing/thesis/chapters/07_causal_methodology.tex,Thesis,line 94: assumption | methodological requirement | repository support | unresolved limitation,WORKFLOW,assumption | methodological requirement | repository support | unresolved limitation,,,cross-thesis evidence audit,thesis; checked source/tables,SUPPORTED_WITH_QUALIFICATION,EXPLICITLY_BOUNDED,CONSISTENT,ALIGNED,NOT_APPLICABLE,RETAIN,Scope and terminology bounded.
C0314,thesis-writing/thesis/chapters/07_causal_methodology.tex,Thesis,line 98: assumption | methodological requirement | repository support | unresolved limitation,WORKFLOW,assumption | methodological requirement | repository support | unresolved limitation,,,cross-thesis evidence audit,thesis; checked source/tables,SUPPORTED_WITH_QUALIFICATION,EXPLICITLY_BOUNDED,CONSISTENT,ALIGNED,NOT_APPLICABLE,RETAIN,Scope and terminology bounded.
C0315,thesis-writing/thesis/chapters/07_causal_methodology.tex,Thesis,"line 101: Graph correctness for the target question | The DAG must correctly represent the relevant causal structure for the exposure contrast and mortality outcome. | Dataset-specific graphs are project-specified and encoded in active source. | The arrows were not learned from data, and the human clinical review record remains incomplete.",IMPLEMENTATION,"Graph correctness for the target question | The DAG must correctly represent the relevant causal structure for the exposure contrast and mortality outcome. | Dataset-specific graphs are project-specified and encoded in active source. | The arrows were not learned from data, and the human clinical review record remains incomplete.",,,cross-thesis evidence audit,thesis; checked source/tables,SUPPORTED_WITH_QUALIFICATION,EXPLICITLY_BOUNDED,CONSISTENT,ALIGNED,NOT_APPLICABLE,RETAIN,Scope and terminology bounded.
C0316,thesis-writing/thesis/chapters/07_causal_methodology.tex,Thesis,"line 102: Sufficient measured adjustment | Available adjustment variables must block the relevant open backdoor paths for each proxy exposure. | The helper tests path blocking within the implemented DAG using mapped background and latent columns. | Graph variables may be unavailable, and unmeasured or misspecified confounding outside the project DAG remains possible.",IMPLEMENTATION,"Sufficient measured adjustment | Available adjustment variables must block the relevant open backdoor paths for each proxy exposure. | The helper tests path blocking within the implemented DAG using mapped background and latent columns. | Graph variables may be unavailable, and unmeasured or misspecified confounding outside the project DAG remains possible.",,,cross-thesis evidence audit,thesis; checked source/tables,SUPPORTED_WITH_QUALIFICATION,EXPLICITLY_BOUNDED,CONSISTENT,ALIGNED,NOT_APPLICABLE,RETAIN,Scope and terminology bounded.
C0317,thesis-writing/thesis/chapters/07_causal_methodology.tex,Thesis,line 103: Positivity or overlap | Comparable covariate strata must contain both exposed and unexposed records. | Matching outputs report match availability and match rates. | Dedicated treatment-specific overlap diagnostics and thresholds remain to be approved.,WORKFLOW,Positivity or overlap | Comparable covariate strata must contain both exposed and unexposed records. | Matching outputs report match availability and match rates. | Dedicated treatment-specific overlap diagnostics and thresholds remain to be approved.,,,cross-thesis evidence audit,thesis; checked source/tables,SUPPORTED_WITH_QUALIFICATION,EXPLICITLY_BOUNDED,CONSISTENT,ALIGNED,NOT_APPLICABLE,RETAIN,Scope and terminology bounded.
C0318,thesis-writing/thesis/chapters/07_causal_methodology.tex,Thesis,"line 104: Consistency and well-defined exposure | Each binary proxy-state contrast must have a sufficiently stable meaning across records. | The pipeline applies one binary exposure column at a time. | Disease-state and severity proxies are not necessarily assignable interventions, so the causal estimand remains unresolved.",WORKFLOW,"Consistency and well-defined exposure | Each binary proxy-state contrast must have a sufficiently stable meaning across records. | The pipeline applies one binary exposure column at a time. | Disease-state and severity proxies are not necessarily assignable interventions, so the causal estimand remains unresolved.",,,cross-thesis evidence audit,thesis; checked source/tables,SUPPORTED_WITH_QUALIFICATION,EXPLICITLY_BOUNDED,CONSISTENT,ALIGNED,NOT_APPLICABLE,RETAIN,Scope and terminology bounded.
C0319,thesis-writing/thesis/chapters/07_causal_methodology.tex,Thesis,"line 105: Proxy-state measurement | The binary exposure should measure the intended construct with sufficiently limited construct and classification error. | Exposure columns are rule-derived, predicted, or majority-vote proxy states. | No code path verifies construct validity or removes proxy-state measurement error; clinical and chart-review validation remains incomplete.",IMPLEMENTATION,"Proxy-state measurement | The binary exposure should measure the intended construct with sufficiently limited construct and classification error. | Exposure columns are rule-derived, predicted, or majority-vote proxy states. | No code path verifies construct validity or removes proxy-state measurement error; clinical and chart-review validation remains incomplete.",,,cross-thesis evidence audit,thesis; checked source/tables,SUPPORTED_WITH_QUALIFICATION,EXPLICITLY_BOUNDED,CONSISTENT,ALIGNED,NOT_APPLICABLE,RETAIN,Scope and terminology bounded.
C0320,thesis-writing/thesis/chapters/07_causal_methodology.tex,Thesis,"line 106: Outcome measurement | The processed field must be consistently and correctly constructed from the outcome artifact. | Both estimator paths merge this processed outcome column by record identifier and require it to be present. | Source checks establish schema availability, not endpoint validity or cross-dataset construction equivalence.",IMPLEMENTATION,"Outcome measurement | The processed field must be consistently and correctly constructed from the outcome artifact. | Both estimator paths merge this processed outcome column by record identifier and require it to be present. | Source checks establish schema availability, not endpoint validity or cross-dataset construction equivalence.",,,cross-thesis evidence audit,thesis; checked source/tables,SUPPORTED_WITH_QUALIFICATION,EXPLICITLY_BOUNDED,CONSISTENT,ALIGNED,NOT_APPLICABLE,RETAIN,Scope and terminology bounded.
