claim_id,file,chapter_or_section,line_or_excerpt,claim_type,claim_summary,numeric_expression,citation_keys,authoritative_source,exact_source_location,support_status,qualification_status,terminology_status,hierarchy_status,cross_language_status,required_action,notes
C0157,thesis-writing/thesis/chapters/02_background_related_work.tex,Thesis,"line 175: Modern HTE reviews emphasize principled separation of hypothesis generation from confirmation, careful performance criteria, and the instability of data-driven subgroups [citation]. Critical-care populations add marked variation in baseline risk, disease mechanisms, and competing trajectories. Heterogeneity in observed outcomes or prognosis can be mistaken for heterogeneity of treatment effect, and average trial results can conceal clinically important variation while explora",LITERATURE_SYNTHESIS,"Modern HTE reviews emphasize principled separation of hypothesis generation from confirmation, careful performance criteria, and the instability of data-driven subgroups [citation]. Critical-care populations add marked variation in baseline risk, disease mechanisms, and competing trajectories. Heterogeneity in observed outcomes or prognosis can be mistaken for heterogeneity of treatment effect, and average trial results can conceal clinically important variation while exploratory subgroup analyses can also produce spurious patterns [citation]. These considerations motivate conditional-effect modeling in the thesis but do not imply that its proxy-state analyses validate individualized clinical effects.",2024;2024;2015,lipkovich_2024_modern_hte_methods;curth_2024_ml_individualized_treatment_effects;iwashyna_2015_hte_critical_care,approved bibliography/catalog,references.bib: lipkovich_2024_modern_hte_methods;curth_2024_ml_individualized_treatment_effects;iwashyna_2015_hte_critical_care,SUPPORTED,NOT_REQUIRED,CONSISTENT,NOT_APPLICABLE,NOT_APPLICABLE,RETAIN,Key and placement audited.
C0158,thesis-writing/thesis/chapters/02_background_related_work.tex,Thesis,"line 177: The empirical study evaluates CausalPFN in an exploratory role, while its detailed theoretical positioning remains limited pending a verified primary method source.",LITERATURE_SYNTHESIS,"The empirical study evaluates CausalPFN in an exploratory role, while its detailed theoretical positioning remains limited pending a verified primary method source.",,,cross-thesis evidence audit,thesis; checked source/tables,SUPPORTED_WITH_QUALIFICATION,EXPLICITLY_BOUNDED,CONSISTENT,ALIGNED,NOT_APPLICABLE,RETAIN,Scope and terminology bounded.
C0159,thesis-writing/thesis/chapters/02_background_related_work.tex,Thesis,"line 181: Positivity requires that the exposure conditions being compared are possible within relevant covariate strata. Its empirical counterpart, overlap or common support, asks whether comparable exposed and unexposed observations exist in the analyzed sample. When propensity scores approach their boundaries, estimates rely on a small number of observations or extrapolation, producing instability and changing the population for which a comparison is credible. Work on limited overlap",LITERATURE_SYNTHESIS,"Positivity requires that the exposure conditions being compared are possible within relevant covariate strata. Its empirical counterpart, overlap or common support, asks whether comparable exposed and unexposed observations exist in the analyzed sample. When propensity scores approach their boundaries, estimates rely on a small number of observations or extrapolation, producing instability and changing the population for which a comparison is credible. Work on limited overlap formalizes the variance and target-population consequences and motivates explicit attention to the region of adequate support [citation].",2009,crump_et_al_2009_limited_overlap,approved bibliography/catalog,references.bib: crump_et_al_2009_limited_overlap,SUPPORTED,NOT_REQUIRED,CONSISTENT,NOT_APPLICABLE,NOT_APPLICABLE,RETAIN,Key and placement audited.
C0160,thesis-writing/thesis/chapters/02_background_related_work.tex,Thesis,"line 183: Overlap is especially important for heterogeneous-effect estimation because local estimates divide the sample into increasingly specific covariate neighborhoods. A global mixture of exposed and unexposed records can coexist with local support failures. Matching rates, failures, and distances can provide indirect evidence about available comparisons, but they depend on the matching representation and algorithm. They do not replace propensity-score distributions, common-support",LITERATURE_SYNTHESIS,"Overlap is especially important for heterogeneous-effect estimation because local estimates divide the sample into increasingly specific covariate neighborhoods. A global mixture of exposed and unexposed records can coexist with local support failures. Matching rates, failures, and distances can provide indirect evidence about available comparisons, but they depend on the matching representation and algorithm. They do not replace propensity-score distributions, common-support plots, or covariate-balance assessment. Conversely, empirical overlap does not establish exchangeability or validate the DAG. This thesis therefore treats support diagnostics as necessary qualification and does not claim that positivity has been established.",,,cross-thesis evidence audit,thesis; checked source/tables,SUPPORTED_WITH_QUALIFICATION,EXPLICITLY_BOUNDED,CONSISTENT,ALIGNED,NOT_APPLICABLE,RETAIN,Scope and terminology bounded.
C0161,thesis-writing/thesis/chapters/02_background_related_work.tex,Thesis,"line 187: Even after adjustment, observational estimates can be biased by variables that affect both exposure and outcome but are absent from the model. Omitted-variable-bias sensitivity analysis asks how strongly such a variable would need to relate to the residualized exposure and outcome to change a conclusion. Robustness values provide a compact strength-of-confounding summary, while comparison with observed covariates can make a hypothetical confounder scale more interpretable [ci",LITERATURE_SYNTHESIS,"Even after adjustment, observational estimates can be biased by variables that affect both exposure and outcome but are absent from the model. Omitted-variable-bias sensitivity analysis asks how strongly such a variable would need to relate to the residualized exposure and outcome to change a conclusion. Robustness values provide a compact strength-of-confounding summary, while comparison with observed covariates can make a hypothetical confounder scale more interpretable [citation]. Extensions to causal machine learning formulate analogous bias bounds and inference for broader target parameters and flexible nuisance estimation [citation].",2020;2026,cinelli_hazlett_2020_sensitivity;chernozhukov_et_al_2026_ovb_causal_ml,approved bibliography/catalog,references.bib: cinelli_hazlett_2020_sensitivity;chernozhukov_et_al_2026_ovb_causal_ml,SUPPORTED,NOT_REQUIRED,CONSISTENT,NOT_APPLICABLE,NOT_APPLICABLE,RETAIN,Key and placement audited.
C0162,thesis-writing/thesis/chapters/02_background_related_work.tex,Thesis,"line 189: Sensitivity results remain model- and scale-dependent. Benchmarking is persuasive only when the selected observed covariate is scientifically meaningful, and no observed benchmark necessarily bounds every unmeasured process. A robustness value does not prove that unmeasured confounding is absent. Sensitivity analysis also does not validate a DAG, create support, or repair exposure misclassification. Its role is to quantify how conclusions would respond to specified departures",LITERATURE_SYNTHESIS,"Sensitivity results remain model- and scale-dependent. Benchmarking is persuasive only when the selected observed covariate is scientifically meaningful, and no observed benchmark necessarily bounds every unmeasured process. A robustness value does not prove that unmeasured confounding is absent. Sensitivity analysis also does not validate a DAG, create support, or repair exposure misclassification. Its role is to quantify how conclusions would respond to specified departures from an identifying assumption.",,,cross-thesis evidence audit,thesis; checked source/tables,SUPPORTED_WITH_QUALIFICATION,EXPLICITLY_BOUNDED,CONSISTENT,ALIGNED,NOT_APPLICABLE,RETAIN,Scope and terminology bounded.
C0163,thesis-writing/thesis/chapters/02_background_related_work.tex,Thesis,"line 191: More broadly, transparent causal workflows separate modeling assumptions, identification, estimation, and attempts to refute or perturb the analysis. DoWhy articulates this model--identify--estimate--refute sequence and implements placebo and other robustness checks as software-supported diagnostics [citation]. The value of such checks is procedural: they can expose sensitivity to broken relationships or alternative assumptions. They do not turn every perturbation into a form",LITERATURE_SYNTHESIS,"More broadly, transparent causal workflows separate modeling assumptions, identification, estimation, and attempts to refute or perturb the analysis. DoWhy articulates this model--identify--estimate--refute sequence and implements placebo and other robustness checks as software-supported diagnostics [citation]. The value of such checks is procedural: they can expose sensitivity to broken relationships or alternative assumptions. They do not turn every perturbation into a formal randomization test, and the citation does not imply that every DoWhy refuter was used in this thesis.",2020,sharma_kiciman_2020_dowhy,approved bibliography/catalog,references.bib: sharma_kiciman_2020_dowhy,SUPPORTED,NOT_REQUIRED,CONSISTENT,NOT_APPLICABLE,NOT_APPLICABLE,RETAIN,Key and placement audited.
C0164,thesis-writing/thesis/chapters/02_background_related_work.tex,Thesis,line 195: The literature supplies complementary components rather than one end-to-end solution. Models for irregular series address representation and prediction; phenotyping provides transparent routes from EHR evidence to analytical labels; weak supervision explains how imperfect sources may be combined; DAGs make identification assumptions explicit; DML and forest methods enable flexible adjusted and heterogeneous-effect estimation; and overlap and sensitivity methods expose fragili,LITERATURE_SYNTHESIS,"The literature supplies complementary components rather than one end-to-end solution. Models for irregular series address representation and prediction; phenotyping provides transparent routes from EHR evidence to analytical labels; weak supervision explains how imperfect sources may be combined; DAGs make identification assumptions explicit; DML and forest methods enable flexible adjusted and heterogeneous-effect estimation; and overlap and sensitivity methods expose fragility in support and unmeasured-confounding assumptions. The contribution of this thesis is to integrate and evaluate these components through a shared, evidence-tracked proxy-state interface, not to claim invention of each component.",,,cross-thesis evidence audit,thesis; checked source/tables,SUPPORTED_WITH_QUALIFICATION,EXPLICITLY_BOUNDED,CONSISTENT,ALIGNED,NOT_APPLICABLE,RETAIN,Scope and terminology bounded.
C0165,thesis-writing/thesis/chapters/02_background_related_work.tex,Thesis,line 197: Integration also compounds risk. Measurement error in source events can affect rule-derived labels; model error can alter predicted labels; aggregation can preserve shared error; a project-specified DAG can be misspecified; local comparisons can lack support; and unmeasured confounding can remain after flexible estimation. Provenance gaps can make it difficult to determine which version of an artifact entered the next stage. LLM prompts contributed candidate proxy-state and D,LITERATURE_SYNTHESIS,"Integration also compounds risk. Measurement error in source events can affect rule-derived labels; model error can alter predicted labels; aggregation can preserve shared error; a project-specified DAG can be misspecified; local comparisons can lack support; and unmeasured confounding can remain after flexible estimation. Provenance gaps can make it difficult to determine which version of an artifact entered the next stage. LLM prompts contributed candidate proxy-state and DAG design provenance, but were not an executed estimator, causal-discovery method, source of authoritative clinical judgment, or source of clinical validation. Chapters [cross-reference]--[cross-reference] therefore define the actual study objects, implementation, assumptions, and diagnostic hierarchy. This progression preserves the central lesson of the related work: credible integration requires every handoff and l",,,cross-thesis evidence audit,thesis; checked source/tables,SUPPORTED_WITH_QUALIFICATION,EXPLICITLY_BOUNDED,CONSISTENT,ALIGNED,NOT_APPLICABLE,RETAIN,Scope and terminology bounded.
C0166,thesis-writing/thesis/chapters/03_problem_definition_study_design.tex,Thesis,"line 9: This thesis studies retrospective intensive-care records represented as irregular clinical time series. The operational study unit is a time-series record or ICU stay, depending on the source dataset and preprocessing path. PhysioNet 2012 source files use record identifiers, whereas MIMIC-III source tables use ICU-stay and admission identifiers. The implemented pipelines normalize these source-specific identifiers to the canonical join key . This identifier should be read as ",IMPLEMENTATION,"This thesis studies retrospective intensive-care records represented as irregular clinical time series. The operational study unit is a time-series record or ICU stay, depending on the source dataset and preprocessing path. PhysioNet 2012 source files use record identifiers, whereas MIMIC-III source tables use ICU-stay and admission identifiers. The implemented pipelines normalize these source-specific identifiers to the canonical join key . This identifier should be read as the analysis-record identifier used by the software; it is not assumed to be a globally unique person identifier across repeated admissions or stays.",2012,,cross-thesis evidence audit,thesis; checked source/tables,SUPPORTED_WITH_QUALIFICATION,EXPLICITLY_BOUNDED,CONSISTENT,ALIGNED,NOT_APPLICABLE,RETAIN,Scope and terminology bounded.
C0167,thesis-writing/thesis/chapters/03_problem_definition_study_design.tex,Thesis,"line 11: For a study unit \(i\), the observed longitudinal data are represented as a finite collection of measurement events \[ _i = \(i,t_ij,v_ij,x_ij) : j=1,,n_i\, \] where \(i\) is the normalized , \(t_ij\) is elapsed time in minutes from record start or ICU admission, \(v_ij\) is the observed variable name, and \(x_ij\) is the numeric value recorded for that variable. In the causal repository this long-format object is stored in with the required columns , , , and . Static or base",IMPLEMENTATION,"For a study unit \(i\), the observed longitudinal data are represented as a finite collection of measurement events \[ _i = \(i,t_ij,v_ij,x_ij) : j=1,,n_i\, \] where \(i\) is the normalized , \(t_ij\) is elapsed time in minutes from record start or ICU admission, \(v_ij\) is the observed variable name, and \(x_ij\) is the numeric value recorded for that variable. In the causal repository this long-format object is stored in with the required columns , , , and . Static or baseline quantities such as age, sex or gender coding, height, weight, and ICU-type indicators are represented within the same event schema as variables observed at or near the beginning of the record when the preprocessing implementation provides them.",1,,cross-thesis evidence audit,thesis; checked source/tables,SUPPORTED_WITH_QUALIFICATION,EXPLICITLY_BOUNDED,CONSISTENT,ALIGNED,NOT_APPLICABLE,RETAIN,Scope and terminology bounded.
C0168,thesis-writing/thesis/chapters/03_problem_definition_study_design.tex,Thesis,"line 17: The event representation is intentionally irregular. Observations occur at nonuniform times, different variables are measured with different frequencies, and most variables are absent at most possible times. A missing measurement is therefore not interpreted as a normal value. It may reflect a clinical decision not to measure, an unrecorded observation, a source-table limitation, or a preprocessing exclusion. The thesis treats informative measurement and missingness processes",WORKFLOW,"The event representation is intentionally irregular. Observations occur at nonuniform times, different variables are measured with different frequencies, and most variables are absent at most possible times. A missing measurement is therefore not interpreted as a normal value. It may reflect a clinical decision not to measure, an unrecorded observation, a source-table limitation, or a preprocessing exclusion. The thesis treats informative measurement and missingness processes as important threats to interpretation, not as causal findings established by the repository.",,,cross-thesis evidence audit,thesis; checked source/tables,SUPPORTED_WITH_QUALIFICATION,EXPLICITLY_BOUNDED,CONSISTENT,ALIGNED,NOT_APPLICABLE,RETAIN,Scope and terminology bounded.
C0169,thesis-writing/thesis/chapters/03_problem_definition_study_design.tex,Thesis,"line 19: The primary patient- or stay-level outcome used by the downstream causal repository is . In the causal processed artifact, this outcome is stored in , the outcome table keyed by . The third object in that processed artifact, , is the sorted collection of normalized identifiers represented in . Later predictive processing uses a distinct split-aware artifact and must not be conflated with this causal contract.",IMPLEMENTATION,"The primary patient- or stay-level outcome used by the downstream causal repository is . In the causal processed artifact, this outcome is stored in , the outcome table keyed by . The third object in that processed artifact, , is the sorted collection of normalized identifiers represented in . Later predictive processing uses a distinct split-aware artifact and must not be conflated with this causal contract.",,,cross-thesis evidence audit,thesis; checked source/tables,SUPPORTED_WITH_QUALIFICATION,EXPLICITLY_BOUNDED,CONSISTENT,ALIGNED,NOT_APPLICABLE,RETAIN,Scope and terminology bounded.
C0170,thesis-writing/thesis/chapters/03_problem_definition_study_design.tex,Thesis,"line 26: The prediction task is a multi-label proxy-state prediction problem over irregular ICU time series. For each study unit \(i\) and proxy state \(k\), let \(L^rule_ik\0,1\\) denote a rule-derived proxy label. These labels are clinically inspired analytical constructs generated from observed data and deterministic source-code rules. They are weak clinical labels or proxy phenotypes, not chart-adjudicated diagnoses, manually verified clinical states, or validated phenotypes unles",IMPLEMENTATION,"The prediction task is a multi-label proxy-state prediction problem over irregular ICU time series. For each study unit \(i\) and proxy state \(k\), let \(L^rule_ik\0,1\\) denote a rule-derived proxy label. These labels are clinically inspired analytical constructs generated from observed data and deterministic source-code rules. They are weak clinical labels or proxy phenotypes, not chart-adjudicated diagnoses, manually verified clinical states, or validated phenotypes unless separate validation evidence is supplied in a later chapter.","0,1",,cross-thesis evidence audit,thesis; checked source/tables,SUPPORTED_WITH_QUALIFICATION,EXPLICITLY_BOUNDED,CONSISTENT,ALIGNED,NOT_APPLICABLE,RETAIN,Scope and terminology bounded.
C0171,thesis-writing/thesis/chapters/03_problem_definition_study_design.tex,Thesis,"line 28: The supervised predictive workflow estimates a vector of proxy-state labels from the observed time-series representation. Its target matrix is loaded from a latent-label CSV keyed by ; the supervised proxy-label targets are not taken from the mortality column in . For model \(m\), the exported prediction object may contain probabilities \( p^(m)_ik\) and corresponding binary predicted labels \( L^(m)_ik\). These outputs are model estimates of rule-derived proxy labels rather ",WORKFLOW,"The supervised predictive workflow estimates a vector of proxy-state labels from the observed time-series representation. Its target matrix is loaded from a latent-label CSV keyed by ; the supervised proxy-label targets are not taken from the mortality column in . For model \(m\), the exported prediction object may contain probabilities \( p^(m)_ik\) and corresponding binary predicted labels \( L^(m)_ik\). These outputs are model estimates of rule-derived proxy labels rather than direct measurements of patient physiology.",,,cross-thesis evidence audit,thesis; checked source/tables,SUPPORTED_WITH_QUALIFICATION,EXPLICITLY_BOUNDED,CONSISTENT,ALIGNED,NOT_APPLICABLE,RETAIN,Scope and terminology bounded.
C0172,thesis-writing/thesis/chapters/03_problem_definition_study_design.tex,Thesis,"line 30: At the level of study design, five analytical tasks are distinguished. First, rule-based proxy-state construction derives binary proxy labels from observed clinical measurements. Second, multi-label proxy-state prediction estimates those rule-derived labels from irregular time-series inputs. Third, proxy-label aggregation may combine binary outputs from several voter sources into a single proxy-state table. Fourth, mortality prediction or association analysis evaluates whethe",WORKFLOW,"At the level of study design, five analytical tasks are distinguished. First, rule-based proxy-state construction derives binary proxy labels from observed clinical measurements. Second, multi-label proxy-state prediction estimates those rule-derived labels from irregular time-series inputs. Third, proxy-label aggregation may combine binary outputs from several voter sources into a single proxy-state table. Fourth, mortality prediction or association analysis evaluates whether proxy-state representations contain prognostic information about . Fifth, observational causal-effect estimation treats selected proxy-state indicators as modeled exposures and estimates adjusted contrasts under explicit assumptions. Detailed proxy rules, model architectures, estimator algorithms, and numerical results are intentionally deferred to later chapters.",,,cross-thesis evidence audit,thesis; checked source/tables,SUPPORTED_WITH_QUALIFICATION,EXPLICITLY_BOUNDED,CONSISTENT,ALIGNED,NOT_APPLICABLE,RETAIN,Scope and terminology bounded.
C0173,thesis-writing/thesis/chapters/03_problem_definition_study_design.tex,Thesis,"line 37: The downstream causal-analysis setting is retrospective and observational. No intervention is assigned by this study. The repository uses software parameters named for selected binary columns, but many such columns represent illness-state or organ-dysfunction proxy states rather than well-defined administered therapies. In the thesis narrative these variables are therefore described as proxy-state exposures or modeled treatment variables unless a later section explicitly defi",WORKFLOW,"The downstream causal-analysis setting is retrospective and observational. No intervention is assigned by this study. The repository uses software parameters named for selected binary columns, but many such columns represent illness-state or organ-dysfunction proxy states rather than well-defined administered therapies. In the thesis narrative these variables are therefore described as proxy-state exposures or modeled treatment variables unless a later section explicitly defines a manipulable intervention.",,,cross-thesis evidence audit,thesis; checked source/tables,SUPPORTED_WITH_QUALIFICATION,EXPLICITLY_BOUNDED,CONSISTENT,ALIGNED,NOT_APPLICABLE,RETAIN,Scope and terminology bounded.
C0174,thesis-writing/thesis/chapters/03_problem_definition_study_design.tex,Thesis,"line 39: Let \(A_i\0,1\\) denote a selected proxy-state exposure, \(Y_i\) denote the binary outcome , \(W_i\) denote observed adjustment variables selected from a project-specified DAG and available columns, and \(X_i\) denote effect-modifier features used to describe heterogeneity. The dataset-specific DAGs were developed through a project design process that included LLM-assisted clinical and causal elicitation and were then encoded in source code; the implemented graph scripts, not",IMPLEMENTATION,"Let \(A_i\0,1\\) denote a selected proxy-state exposure, \(Y_i\) denote the binary outcome , \(W_i\) denote observed adjustment variables selected from a project-specified DAG and available columns, and \(X_i\) denote effect-modifier features used to describe heterogeneity. The dataset-specific DAGs were developed through a project design process that included LLM-assisted clinical and causal elicitation and were then encoded in source code; the implemented graph scripts, not the prompt outputs alone, define the DAG artifacts used by the pipeline. Potential-outcome notation such as \(Y_i(a)\) is useful as conceptual language, but causal interpretation requires more than the presence of a graph or an estimator. It depends on assumptions about the causal graph, consistency, exchangeability conditional on observed covariates, positivity or overlap, outcome and exposure measurement, and unme","0,1;1995;2016;2008",pearl_1995_causal_diagrams;hernan_robins_2016_target_trial;hernan_taubman_2008_well_defined_interventions,approved bibliography/catalog,references.bib: pearl_1995_causal_diagrams;hernan_robins_2016_target_trial;hernan_taubman_2008_well_defined_interventions,SUPPORTED,NOT_REQUIRED,CONSISTENT,NOT_APPLICABLE,NOT_APPLICABLE,RETAIN,Key and placement audited.
